{
  "schema": "assetsstudio_hair_bundle_recipe_v1",
  "id": "female_chloe_seed_04_bangs04",
  "status": "provisional",
  "gender": "female",
  "source_blend": "milestones/hair/sources/female/chloe_hair_source.blend",
  "actor_blend": "milestones/body/chibi_actor_mixamo_walk_v1.blend",
  "source_anchor_object": "Chloe_head_dummy",
  "components": [
    "Chloe_hair_bangs_04",
    "Chloe_hair_side_01",
    "Chloe_hair_back_01"
  ],
  "fit": {
    "normalize_source_component_layout": true,
    "q_height_ratio": 1.15,
    "width_ratio": 1.18
  },
  "material": {
    "rgba": [0.12, 0.045, 0.025, 1.0]
  },
  "binding": {
    "bone": "CC_Base_Head",
    "web_contract": "single_bone_skin"
  },
  "cache": {
    "directory": "workspace/cache/hair/first_bundle",
    "blend": "actor_hair_seed_04.blend",
    "thumbnail": "front.png"
  },
  "known_issue": "current rebuild has a small visible center-part scalp seam; user review required"
}
